{"mana_cap": 10, "initial_mana_regen": 5, "initial_health": 25, "stickies": [{"name": "Shield", "text": "Blocks damage from attacks.", "kind": "shield", "trigger": {"inbound": true, "effect": {"effect_type": ["attack"]}}, "id": "shield"}, {"name": "Poison", "text": "Deals 1 damage each turn.", "kind": "id", "trigger": {"turn": true}, "effects": [{"kind": "health", "effect_type": "poison", "self": true, "amount": -1}], "stacks": true, "id": "poison"}, {"name": "Storm", "text": "Increase Gathering Storm's damage by 1.", "kind": "delta", "trigger": {"inbound": false, "effect": {"spell_id": ["chain_1"]}}, "id": "storm"}, {"name": "Fatigue", "text": "Casting spells deals 1 poison damage.", "kind": "id", "trigger": {"spell": {}}, "effects": [{"kind": "health", "effect_type": "poison", "self": true, "amount": -1}], "id": "spell_poison"}, {"name": "Damper", "text": "Decreases the strength of incoming attacks.", "kind": "damper", "trigger": {"inbound": true, "effect": {"effect_type": ["attack"]}}, "id": "damper"}, {"name": "Antidote", "text": "Blocks damage from poison.", "kind": "shield", "trigger": {"inbound": true, "effect": {"effect_type": ["poison"]}}, "id": "poison_shield"}, {"name": "Fortress", "text": "When you cast a spell, gain a shield that blocks 2 damage.", "kind": "id", "trigger": {"spell": {}}, "effects": [{"kind": "sticky", "effect_type": "shield", "self": true, "sticky": {"sticky_id": "shield", "duration": {"turns": 2}, "amount": 2}}], "id": "shields_from_spells"}, {"name": "Crystal Shield", "text": "Blocks all damage from the next attack.", "kind": "super_shield", "trigger": {"inbound": true, "effect": {"effect_type": ["attack"]}}, "id": "super_shield"}, {"name": "Suck Mana", "text": "Enemy is draining 1 mana per turn.", "kind": "id", "trigger": {"turn": true}, "effects": [{"kind": "mana", "effect_type": "special", "self": true, "amount": -1}, {"kind": "mana", "effect_type": "special", "self": false, "amount": 1}], "stacks": true, "id": "suck_mana"}, {"name": "Censure", "text": "Lose 5 health if you cast a tech spell next turn.", "kind": "id", "trigger": {"turn": true}, "effects": [{"kind": "sticky", "effect_type": "special", "self": true, "sticky": {"sticky_id": "antitech", "duration": {"turns": 1}}}], "id": "antitech_next"}, {"name": "Censure", "text": "Lose 5 health if you cast a tech spell.", "kind": "id", "trigger": {"spell": {"effect_type": ["tech"]}}, "effects": [{"kind": "health", "effect_type": "constant", "self": true, "amount": -5}], "id": "antitech"}, {"name": "Interdict", "text": "Lose 6 health for each spell you cast this turn.", "kind": "id", "trigger": {"spell": {}}, "effects": [{"kind": "health", "effect_type": "constant", "self": true, "amount": -6}], "id": "antispell"}], "spells": [{"name": "Learn Conjuration", "text": "Increase Conjuration by 1.", "tech": 0, "level": 0, "cost": 0, "effects": [{"kind": "tech", "effect_type": "tech", "self": true, "amount": 1}], "book": "conjuration", "id": "conjuration_tech"}, {"name": "Flame Strike", "text": "Deal 3 damage.", "tech": 1, "level": 1, "cost": 1, "effects": [{"kind": "health", "effect_type": "attack", "self": false, "amount": -3}], "book": "conjuration", "id": "conjuration_attack_1"}, {"name": "Ripple Shield", "text": "Block 8 damage this turn.", "tech": 1, "level": 1, "cost": 3, "effects": [{"kind": "sticky", "effect_type": "shield", "self": true, "sticky": {"sticky_id": "shield", "duration": {"turns": 1}, "amount": 8}}], "book": "conjuration", "id": "conjuration_shield_1"}, {"name": "Fiery Spirit", "text": "Increase mana regeneration by 1.", "tech": 2, "level": 2, "cost": 2, "effects": [{"kind": "mana_regen", "effect_type": "special", "self": true, "amount": 1}], "book": "conjuration", "id": "conjuration_mana_1"}, {"name": "Erupt", "text": "Deal 7 damage.", "tech": 2, "level": 2, "cost": 3, "effects": [{"kind": "health", "effect_type": "attack", "self": false, "amount": -7}], "book": "conjuration", "id": "conjuration_attack_2"}, {"name": "Learn Regulation", "text": "Increase Regulation by 1.", "tech": 0, "level": 0, "cost": 0, "effects": [{"kind": "tech", "effect_type": "tech", "self": true, "amount": 1}], "book": "regulation", "id": "regulation_tech"}, {"name": "Focus", "text": "Deal 2 damage. Increase mana regeneration by 1.", "tech": 1, "level": 1, "cost": 2, "effects": [{"kind": "health", "effect_type": "attack", "self": false, "amount": -2}, {"kind": "mana_regen", "effect_type": "special", "self": true, "amount": 1}], "book": "regulation", "id": "regulation_mana_1"}, {"name": "Mana Crystal", "text": "Gain 4 mana next turn.", "tech": 1, "level": 1, "cost": 2, "effects": [{"kind": "mana", "effect_type": "special", "self": true, "amount": 4}], "book": "regulation", "id": "regulation_mana_2"}, {"name": "Shieldbreaker", "text": "Counter opponent's spell if it is a shield. Block 4 damage this turn.", "tech": 2, "level": 2, "cost": 2, "effects": [{"kind": "sticky", "effect_type": "shield", "self": true, "sticky": {"sticky_id": "shield", "duration": {"turns": 1}, "amount": 4}}], "counterspell": {"effect_type": ["shield"]}, "book": "regulation", "id": "regulation_cancel_1"}, {"name": "Piercing Shot", "text": "Deal 6 damage. Cannot be blocked by shields.", "tech": 3, "level": 3, "cost": 3, "effects": [{"kind": "health", "effect_type": "constant", "self": false, "amount": -6}], "book": "regulation", "id": "regulation_attack_1"}, {"name": "Learn Deception", "text": "Increase Deception by 1.", "tech": 0, "level": 0, "cost": 0, "effects": [{"kind": "tech", "effect_type": "tech", "self": true, "amount": 1}], "book": "tricks", "id": "tricks_tech"}, {"name": "Backfire", "text": "Counter opponent's spell. Deal 4 damage.", "tech": 1, "level": 1, "cost": 4, "effects": [{"kind": "health", "effect_type": "attack", "self": false, "amount": -4}], "counterspell": {}, "book": "tricks", "id": "tricks_cancel"}, {"name": "Flickering Shield", "text": "Block 13 damage. Lasts one step.", "tech": 1, "level": 1, "cost": 3, "effects": [{"kind": "sticky", "effect_type": "shield", "self": true, "sticky": {"sticky_id": "shield", "duration": {"steps": 1}, "amount": 13}}], "book": "tricks", "id": "tricks_shield"}, {"name": "Interdict", "text": "Both players lose 6 health for each additional spell they cast this turn.", "tech": 2, "level": 2, "cost": 4, "effects": [{"kind": "sticky", "effect_type": "special", "self": true, "sticky": {"sticky_id": "antispell", "duration": {"turns": 1}}}, {"kind": "sticky", "effect_type": "special", "self": false, "sticky": {"sticky_id": "antispell", "duration": {"turns": 1}}}], "book": "tricks", "id": "tricks_antispell"}, {"name": "Censure", "text": "Your opponent loses 5 health if they cast a tech spell next turn.", "tech": 3, "level": 3, "cost": 2, "effects": [{"kind": "sticky", "effect_type": "special", "self": false, "sticky": {"sticky_id": "antitech_next", "duration": {"turns": 1}}}], "book": "tricks", "id": "tricks_antitech"}], "books": [{"name": "Book of Conjuration", "spells": ["conjuration_tech", "conjuration_attack_1", "conjuration_shield_1", "conjuration_mana_1", "conjuration_attack_2"], "id": "conjuration"}, {"name": "Book of Regulation", "spells": ["regulation_tech", "regulation_mana_1", "regulation_mana_2", "regulation_cancel_1", "regulation_attack_1"], "id": "regulation"}, {"name": "Book of Deception", "spells": ["tricks_tech", "tricks_cancel", "tricks_shield", "tricks_antispell", "tricks_antitech"], "id": "tricks"}]}
